video_id,title,description,published_at,tags,duration_sec,is_short,view_count,like_count,comment_count,thumbnail_url,video_url,year,month,month_name,day_of_week,day_name,week_of_year,engagement_rate,like_rate,comment_rate,performance_tier,title_word_count,title_char_count
2s8KgYcDwG8,No sabemos qué hacer con el canal...,"Las mejores ofertas: https://epical-q.com/ ¿Y si esta vez el vídeo lo decidieras tú? En el sector del gaming y la informática está todo más visto que el TBO: mismas reviews, mismas promos, mismos vídeos clónicos y el mismo contenido reciclado de siempre. Así que hemos parado un momento, nos hemos sentado a pensar y hemos llegado a una conclusión bastante simple: si vosotros sois los que veis el canal, también deberíais decidir qué queréis ver en él. En este vídeo te contamos varias ideas loca",2026-05-17 18:49:55+00:00,,1877,False,10570,1181,275,https://i.ytimg.com/vi/2s8KgYcDwG8/maxresdefault.jpg,https://www.youtube.com/watch?v=2s8KgYcDwG8,2026,5,May,6,Sunday,20,13.775,11.173,2.602,Bajo,7,37
rF8jxRiNqr8,Tierlist Cajas de PC - Mejores Gabinetes para Ordenador Gaming 2026,"Las mejores ofertas: https://epical-q.com/ Las cajas de PC son muchísimo más importantes de lo que parece. Y sí: una mala caja puede convertir un PC de alta gama en una auténtica estufa con thermal throttling, ruido, mal flujo de aire y componentes trabajando peor de lo que deberían. En este vídeo nos metemos de lleno en un tier list de cajas de PC con un montón de modelos que he montado, probado o tenido delante: cajas baratas, peceras, doble cámara, triple cámara, cajas premium, cajas microA",2026-05-10 20:36:17+00:00,,3456,False,14609,842,167,https://i.ytimg.com/vi/rF8jxRiNqr8/maxresdefault.jpg,https://www.youtube.com/watch?v=rF8jxRiNqr8,2026,5,May,6,Sunday,19,6.907,5.764,1.143,Medio,11,67
OYoFSe56Oic,El Día a Día en una Fábrica de PCs Gaming en España,"Si te gusta la informática y quieres saber cuál es el recorrido que hacen un montón de componentes hasta que acaban en un ordenador, te vamos a explicar desde dentro la historia de Epical-Q. Te mostramos cada departamento y te explicamos los entresijos de la empresa que está conquistando tu corazón. Y si quieres una buena silla Usa el código y disfruta de un 5% de descuento exclusivo E3PRO: Enlace del producto a la web oficial: https://bit.ly/3PTp525 code: E3WPEPIC Enlace del producto de Amaz",2026-05-03 17:45:00+00:00,"informatica, hardware, tutoriales, ram, gaming pc build",734,False,27824,1780,120,https://i.ytimg.com/vi/OYoFSe56Oic/maxresdefault.jpg,https://www.youtube.com/watch?v=OYoFSe56Oic,2026,5,May,6,Sunday,18,6.829,6.397,0.431,Medio,12,51
8-WWEAPwQyM,PC Roto por el POLVO,PC Roto por el POLVO ¿Qué piensas tú? Tiene garantía este PC o mejor no El polvo acumulado durante años puede hacer que tu ordenador deje de funcionar como ha ocurrido con este. Te recomendamos que de vez en cuando le hagas una limpieza para no llegar a este extremo.,2026-04-26 18:26:10+00:00,,66,False,15863,924,27,https://i.ytimg.com/vi/8-WWEAPwQyM/maxresdefault.jpg,https://www.youtube.com/watch?v=8-WWEAPwQyM,2026,4,Apr,6,Sunday,17,5.995,5.825,0.17,Medio,5,20
8FmhL1u20kM,Tengo 100.000€ en PCs encima de la mesa… y no son para jugar,"Las mejores ofertas: https://epical-q.com/ ¿Te imaginas tener 100.000€ en PCs encima de una mesa? Pues justo eso es lo que enseñamos hoy. 😈 En este vídeo te enseñamos 3 ordenadores profesionales brutales que hemos montado para empresa y que no tienen nada que ver con el típico PC gaming con lucecitas. Hablamos de máquinas para: audiovisual multipantalla streaming y captura profesional IA, LLM y computación virtualización workstations enterprise extremas Vas a ver desde un equipo de 30.000€, p",2026-04-26 18:00:00+00:00,,705,False,33459,1413,109,https://i.ytimg.com/vi/8FmhL1u20kM/maxresdefault.jpg,https://www.youtube.com/watch?v=8FmhL1u20kM,2026,4,Apr,6,Sunday,17,4.549,4.223,0.326,Medio,13,60
tdZkr9BxXnU,Cuidado con las gangas en RAM.,Cuidado con las gangas en RAM.,2026-04-19 18:39:13+00:00,,92,False,39280,782,8,https://i.ytimg.com/vi/tdZkr9BxXnU/maxresdefault.jpg,https://www.youtube.com/watch?v=tdZkr9BxXnU,2026,4,Apr,6,Sunday,16,2.011,1.991,0.02,Medio,6,30
EXMCS_UP7xY,Todo Sobre Cajas de PC - Elige tu Gabinete Según Componentes,"Las mejores ofertas: https://epical-q.com/ ¿No paras de ver cajas, gabinetes y setups espectaculares pero no tienes claro cuál te conviene de verdad? Entonces este vídeo te interesa. 😈 Hoy hacemos una guía sencilla y sin humo sobre tipos de cajas para PC: qué formato necesitas, qué caja tiene sentido según el ordenador que vayas a montar y en qué casos estás tirando el dinero por pura estética. En este vídeo repasamos: diferencias entre formatos de placa, cajas básicas monocámara, cajas gamin",2026-04-19 18:00:00+00:00,,925,False,13530,1037,117,https://i.ytimg.com/vi/EXMCS_UP7xY/maxresdefault.jpg,https://www.youtube.com/watch?v=EXMCS_UP7xY,2026,4,Apr,6,Sunday,16,8.529,7.664,0.865,Medio,11,60
p7i8VurQE2M,Anecdotas de PCs gaming con Expediente X,Anecdotas de PCs gaming con Expediente X,2026-04-14 18:19:58+00:00,,67,False,28340,2029,16,https://i.ytimg.com/vi/p7i8VurQE2M/maxresdefault.jpg,https://www.youtube.com/watch?v=p7i8VurQE2M,2026,4,Apr,1,Tuesday,16,7.216,7.159,0.056,Medio,7,40
XhG0J45xGZ0,Historias de Informático para Mear y no Echar Gota,"Las mejores ofertas: https://epical-q.com/ Si has trabajado en soporte técnico, reparación de PCs o simplemente has sido “el informático” de tu familia… este vídeo te va a tocar el alma. 😈 Hoy inauguramos una nueva serie: Expedientes Karen, una recopilación de historias reales, incidencias absurdas y momentos surrealistas del soporte remoto informático. 👇 Pregunta seria: ¿Quieres más vídeos de Expedientes Karen? Y si tú has trabajado de técnico, soporte, tienda de informática o algo parecido…",2026-04-12 17:30:00+00:00,,989,False,19727,1526,134,https://i.ytimg.com/vi/XhG0J45xGZ0/maxresdefault.jpg,https://www.youtube.com/watch?v=XhG0J45xGZ0,2026,4,Apr,6,Sunday,15,8.415,7.736,0.679,Medio,9,50
-_uyQ30WVDE,Tierlist de tarjetas gráficas para PCs Gaming,Tierlist de tarjetas gráficas para PCs Gaming,2026-04-08 19:09:57+00:00,,136,False,234531,11597,482,https://i.ytimg.com/vi/-_uyQ30WVDE/maxresdefault.jpg,https://www.youtube.com/watch?v=-_uyQ30WVDE,2026,4,Apr,2,Wednesday,15,5.15,4.945,0.206,Viral,7,45
yK8UnRA50Q4,¿Cuánto espacio de almacenamiento SSD necesitas en tu PC para no quedarte sin espacio?,¿Cuánto espacio de almacenamiento SSD necesitas en tu PC para no quedarte sin espacio? ¿Utilizas el truco de los dos discos?,2026-04-05 18:42:35+00:00,,85,False,39448,2836,59,https://i.ytimg.com/vi/yK8UnRA50Q4/maxresdefault.jpg,https://www.youtube.com/watch?v=yK8UnRA50Q4,2026,4,Apr,6,Sunday,14,7.339,7.189,0.15,Medio,14,86
KAXHiW7zm1w,Cómo Mejorar tu PC Gaming con Poco Presupuesto - Upgrades,"Las mejores ofertas: https://epical-q.com/ ¿Tienes un PC de 5, 6, 7, 8 o hasta 10 años y no te da la pasta para comprarte uno nuevo? Entonces este vídeo te interesa. Con la crisis de la RAM, los discos por las nubes y los precios de los PCs nuevos completamente locos, hoy te contamos qué merece la pena mejorar en un ordenador antiguo y qué no, para que no tires el dinero. En este vídeo hablamos de: - Cuándo un PC ya no merece la pena tocarlo - Por qué DDR3 ya está fuera de juego y desde dónde",2026-04-05 18:00:00+00:00,,1241,False,15885,960,135,https://i.ytimg.com/vi/KAXHiW7zm1w/maxresdefault.jpg,https://www.youtube.com/watch?v=KAXHiW7zm1w,2026,4,Apr,6,Sunday,14,6.893,6.043,0.85,Medio,10,57
AJNiV33KbMA,Tierlist de CPUs Gaming,Tierlist de CPUs con Raúl Deja un icono de 💿 si sabes lo que es la Encarta.,2026-04-02 18:19:41+00:00,,147,False,156475,7203,365,https://i.ytimg.com/vi/AJNiV33KbMA/maxresdefault.jpg,https://www.youtube.com/watch?v=AJNiV33KbMA,2026,4,Apr,3,Thursday,14,4.837,4.603,0.233,Viral,4,23
tJbd1CtqPLY,7 Pecados Capitales del Gaming 👿,"Las mejores ofertas: https://epical-q.com/ ¿Eras de los que ponían la mira al 10 y la skin más rata del Warzone para que no se te viera? Entonces tenemos que hablar. 😈 Hoy repasamos los 7 pecados capitales del gaming: desde el hype y los preorders (sí, Cyberpunk, te miro a ti), hasta la biblioteca de Steam con 700 juegos que no has instalado ni 10… pasando por el pay to win, el colega que no aprende mecánicas y solo copia el meta, la toxicidad, el stream sniping y el elitismo gamer que te dice",2026-03-29 18:38:42+00:00,,398,False,10901,986,81,https://i.ytimg.com/vi/tJbd1CtqPLY/maxresdefault.jpg,https://www.youtube.com/watch?v=tJbd1CtqPLY,2026,3,Mar,6,Sunday,13,9.788,9.045,0.743,Bajo,6,32
AqdAPTNt9ec,"¡El Hardware se HUNDE, la RAM Baja pero Habrá REBOTE! | Noticias PC","Las mejores ofertas en gaming: https://epical-q.com/ Ñiñiñi… ¡CHAN CHAN! Vuelve EPICAL NEWS con Antonio “Chaleco” para repasar lo más calentito del mes en hardware, precios y cacharreo: RAM, SSD, gráficas, DLSS 5, rumores de RTX 5050, el momento raruno de NVIDIA, y por qué Intel Core Ultra empieza a oler mejor que hace un año. Y si quieres una buena silla Usa el código y disfruta de un 5% de descuento exclusivo: Enlace del producto a la web oficial: https://bit.ly/3PTp525 code: E3WPEPIC Enlac",2026-03-22 21:55:53+00:00,,993,False,11512,832,70,https://i.ytimg.com/vi/AqdAPTNt9ec/maxresdefault.jpg,https://www.youtube.com/watch?v=AqdAPTNt9ec,2026,3,Mar,6,Sunday,12,7.835,7.227,0.608,Bajo,13,67
nA8k7c-XgCE,Elimina Dolor de Espalda y Cuello - Con Experto Fisio,"Las mejores ofertas en gaming aquí: https://epical-q.com/ ¿Te duele la espalda, el cuello o la muñeca después de teletrabajar, jugar o estar 8 horas delante del PC? En este vídeo viene Iginio (fisioterapeuta) a contarte qué hacer y qué NO hacer para evitar lo típico: cervicalgia, trapecios cargados, lumbalgia y túnel carpiano. Y si quieres una buena silla Usa el código y disfruta de un 5% de descuento exclusivo: Enlace del producto a la web oficial: https://bit.ly/3P04poX código: EPICAL Enla",2026-03-15 19:33:45+00:00,,857,False,3265,302,29,https://i.ytimg.com/vi/nA8k7c-XgCE/maxresdefault.jpg,https://www.youtube.com/watch?v=nA8k7c-XgCE,2026,3,Mar,6,Sunday,11,10.138,9.25,0.888,Bajo,10,53
UthA29Cxmco,"Contenido y 3D: Nuevas IA, Hardware y Grandes Cambios (con Ángel Avilés)","Si necesitas un PC para crear contenido, trabajar o jugar, las mejores ofertas gaminga: https://epical-q.com/ Canales de Ángel: https://www.youtube.com/@angelaviles.studio https://www.youtube.com/@3dparasubnormales La IA está cambiando el mundo del 3D, los VFX y la creación de contenido: lo que antes requería un “bicharraco” con GPUs brutales y RAM salvaje, hoy muchas veces se resuelve con IA en la nube… o con IA en local si tienes VRAM de verdad. 00:00 – IA y VFX: cómo está cambiando TODO 0",2026-03-08 18:30:00+00:00,,3265,False,6778,369,23,https://i.ytimg.com/vi/UthA29Cxmco/maxresdefault.jpg,https://www.youtube.com/watch?v=UthA29Cxmco,2026,3,Mar,6,Sunday,10,5.783,5.444,0.339,Bajo,12,72
tXbk63TA05A,Mejores Configuraciones Según tu Presupuesto - Ordenador Gaming y Trabajo,Os dejamos listado de PCs mencionados en el vídeo (algunos no son exactos). Recuerda que si quieres clavarlo 100% a tu caso lo vemos por WhatsApp: 665 91 46 65 PC Básico 650€ - https://epical-q.com/producto/epical-q-fluxer-amd-ryzen-5-5500-16gb-500gb-ssd-nvme-rtx-3050-6gb-windows-11-pro/ PC Básico+ 750€ - https://epical-q.com/producto/epical-q-little-jenk-amd-ryzen-5-5600-16gb-500gb-ssd-nvme-rtx-3050-windows-11-pro/ PC Estándar 1.100€ - https://epical-q.com/producto/epical-q-neblox-amd-ryzen-5,2026-03-03 18:30:00+00:00,,1432,False,29234,1344,83,https://i.ytimg.com/vi/tXbk63TA05A/maxresdefault.jpg,https://www.youtube.com/watch?v=tXbk63TA05A,2026,3,Mar,1,Tuesday,10,4.881,4.597,0.284,Medio,10,73
H2QU4p8f16U,Cómo Formatear tu PC e Instalar Windows 11 de Forma CORRECTA,"Las mejores ofertas en gaming aquí: https://epical-q.com/ Guía 100% práctica para reinstalar Windows 11 desde cero cuando el PC va lento, una actualización lo rompe o el sistema ya “arrastra mierda” de años. Raúl explica qué métodos NO recomienda (restablecer, puntos de restauración) y por qué suelen fallar en Windows 11, y se centra en el método destructivo y fiable: USB booteable + instalación limpia. Paso a paso: descargar ISO oficial, crear USB con Rufus (saltando requisitos y la obligación",2026-02-22 19:00:00+00:00,,2119,False,26055,1569,122,https://i.ytimg.com/vi/H2QU4p8f16U/maxresdefault.jpg,https://www.youtube.com/watch?v=H2QU4p8f16U,2026,2,Feb,6,Sunday,8,6.49,6.022,0.468,Medio,11,60
azJwUirB5h0,Jugando al impostor con el equipo Epical. Del 0 al 10,Jugando al impostor con el equipo Epical. Del 0 al 10 ¿Cómo de 0 lo hacen?,2026-02-22 18:52:48+00:00,,86,False,20467,660,6,https://i.ytimg.com/vi/azJwUirB5h0/maxresdefault.jpg,https://www.youtube.com/watch?v=azJwUirB5h0,2026,2,Feb,6,Sunday,8,3.254,3.225,0.029,Medio,11,53
ezmHCyZvUb8,"Guía RAM: Están Montando Malas Unidades (CL, Velocidad, Compatibilidades y +)","Las mejores ofertas en gaming aquí: https://epical-q.com/ Nuevo Testamento de la RAM (2026): qué está pasando con la crisis de precios, por qué el año nuevo chino y el pánico comprador aprietan el stock, cómo ha bajado la “calidad media” (CL más altos incluso en PCs top), y guía clara para elegir RAM hoy: CL (latencia), frecuencia real (MT/s), XMP/EXPO/DOCP, y por qué 2 módulos (Dual Channel) casi siempre rinden y dan menos guerra que 1 o 4. Entra el “melón” de los módulos no binarios (24/48GB)",2026-02-15 19:28:12+00:00,,1174,False,15679,971,89,https://i.ytimg.com/vi/ezmHCyZvUb8/maxresdefault.jpg,https://www.youtube.com/watch?v=ezmHCyZvUb8,2026,2,Feb,6,Sunday,7,6.761,6.193,0.568,Medio,11,77
XngA9B3LoQg,Suben Fuentes de Alimentación y Cajas - Noticias en Hardware - Epical News 1,"Las mejores ofertas en gaming aquí: https://epical-q.com/ Epical News: panorama real del PC en 2026. ¿Por qué no hay 5060 Ti? Subidón de precios (RAM, SSD, GPUs), retirada del “soporte” de precios en NVIDIA*, cuándo conviene AMD vs NVIDIA, rumor del “revival” RTX 3060, fiabilidad real por marcas (datos de campo), lanzamiento 9850X3D y del 9950X3D2. Además: ¿compra inteligente ahora? Premontados y portátiles pueden salir mejor por stock “viejo”. *fuentes de la noticia del msrp de nvidia: https:",2026-02-09 20:12:22+00:00,,1330,False,13462,913,133,https://i.ytimg.com/vi/XngA9B3LoQg/maxresdefault.jpg,https://www.youtube.com/watch?v=XngA9B3LoQg,2026,2,Feb,0,Monday,7,7.77,6.782,0.988,Medio,14,76
QpdimldScd8,¿Cuanta RAM necesitas para Jugar? - Test con Juegos en 2026,"Las mejores ofertas en gaming aquí: https://epical-q.com/ Prueba real de cuánta RAM necesitas para jugar en 2026: medimos 8/16/32/64 GB en DDR5 con y sin Dual Channel y con XMP activado, viendo FPS, estabilidad y sensación de juego en Fortnite, CS, Borderlands y Arc Raiders. Conclusión clara: capacidad sí, pero configuración (dual + XMP) manda. Te dejamos mínimos recomendados y errores típicos a evitar. Resumen rápido: • 8 GB: solo jugar “a pelo”. Inestable si abres algo más. • 16 GB (Dual+XMP",2026-02-01 18:30:00+00:00,,846,False,28269,1751,250,https://i.ytimg.com/vi/QpdimldScd8/maxresdefault.jpg,https://www.youtube.com/watch?v=QpdimldScd8,2026,2,Feb,6,Sunday,5,7.078,6.194,0.884,Medio,11,59
0z1jAxq2TDs,Mejores Monitores para Gaming de 2026,"Las mejores ofertas en gaming aquí: https://epical-q.com/ Guía clara para elegir monitor gaming en 2026: marcas fiables, cómo saber qué panel te conviene (VA/IPS/OLED), qué resolución te renta según tu perfil (competitivo, casual o sibarita), cuántos Hz necesitas de verdad, errores comunes (ghosting, fugas de luz, input-lag), conexiones a exigir (HDMI 2.1 / DP), y modelos recomendados… con lista de “NO comprar”. 00:00 – Intro: por qué este vídeo 00:01:25 – Marcas top y “según modelo” 00:03:40",2026-01-25 21:57:32+00:00,,1553,False,140718,5798,591,https://i.ytimg.com/vi/0z1jAxq2TDs/maxresdefault.jpg,https://www.youtube.com/watch?v=0z1jAxq2TDs,2026,1,Jan,6,Sunday,4,4.54,4.12,0.42,Viral,6,37
Zbf-UyaygT4,Mejores Discos M2 para Gaming 2026 - Tierlist Calidad Precio SSD NVMe,"Las mejores ofertas en gaming aquí: https://epical-q.com/ Guía directa para elegir SSD M.2 NVMe en 2026: diferencias reales entre PCIe 3.0/4.0/5.0, velocidades útiles, qué mirar en controlador + DRAM, marcas/modelos fiables, precios €/TB, y cuándo NO compensa pagar por 5.0. Además, cómo afectan las líneas PCIe y cuándo usar disipador para evitar thermal throttling. Cierra con lista corta de recomendados y consejos de compra claros. 00:00 – Intro: guía SSD M.2 NVMe 00:00:34 – Qué es NVMe M.2 00",2026-01-18 19:00:00+00:00,,1084,False,30297,1577,173,https://i.ytimg.com/vi/Zbf-UyaygT4/maxresdefault.jpg,https://www.youtube.com/watch?v=Zbf-UyaygT4,2026,1,Jan,6,Sunday,3,5.776,5.205,0.571,Medio,12,69
4mjU04Ms--A,"Las Catástrofes del Gaming, ¿el PEOR año?","Las mejores ofertas en gaming aquí: https://epical-q.com/ Recap crudo de 2025 en informática/IT: año nefasto para el usuario y para el sector. Serie RTX 50 con pocas luces y precios altos mientras AMD (RX 9070 XT) da mejor calidad/precio. La crisis de la RAM aprieta (y arrastrará a GPUs y SSD), y Windows 11 ha dado la brasa con updates que rompen cosas. La IA vuela… pero encarece el consumo y deja un reguero de despidos en creativos y tech. Saltos generacionales reales: flojos para lo que cuest",2026-01-11 20:04:01+00:00,,509,False,8554,640,102,https://i.ytimg.com/vi/4mjU04Ms--A/maxresdefault.jpg,https://www.youtube.com/watch?v=4mjU04Ms--A,2026,1,Jan,6,Sunday,2,8.674,7.482,1.192,Bajo,7,41
-BZDe2uHeho,Regalos Para un Gamer Según Presupuesto (mucho RGB),"Las mejores ofertas en gaming aquí: https://epical-q.com/ ¿Buscas regalos para gamers por presupuesto? Aquí te dejamos nuestros favoritos según el presupuesto que tengas. Mádale este vídeo a tus padres, amigo, familia o persona que te tenga que regalar algo. Ah y recuerda salir un rato de tu habitación esta navidad. Os dejamos los enlaces de todo: 🔴 Menos de 50 Calcetines gaming: https://amzn.to/49cv204 Luz en tira led de Action: https://www.action.com/es-es/p/3218224/tira-led-universal-para-g",2026-01-05 18:20:01+00:00,,978,False,7773,584,51,https://i.ytimg.com/vi/-BZDe2uHeho/maxresdefault.jpg,https://www.youtube.com/watch?v=-BZDe2uHeho,2026,1,Jan,0,Monday,2,8.169,7.513,0.656,Bajo,8,51
yfWkAh4T5-U,"Consigue más Rendimiento y FPS en tu Nuevo PC Optimizando Así (BIOS, Win11, Drivers)","Las mejores ofertas en gaming aquí: https://epical-q.com/ ¿Tu PC va lento aunque sea nuevo? Te enseño trucos seguros y efectivos para acelerar Windows 10/11 sin romper nada: limpia el arranque (programas de inicio que sobran), olvídate de “limpiadores de registro” tipo CCleaner (Microsoft no los recomienda), actualiza con cabeza (parches de seguridad sí; las 24H2/25H2 cuando estén estables), cuándo actualizar drivers (GPU) y cuándo NO tocar la BIOS, y el uso correcto de antivirus (Defender vs.",2025-12-28 20:01:49+00:00,,609,False,20271,1478,138,https://i.ytimg.com/vi/yfWkAh4T5-U/maxresdefault.jpg,https://www.youtube.com/watch?v=yfWkAh4T5-U,2025,12,Dec,6,Sunday,52,7.972,7.291,0.681,Medio,14,84
Jt_PkKK2vzc,La Verdad de la RAM Contada por un Fabricante de PCs,"Las mejores ofertas en gaming aquí: https://epical-q.com/ Crisis de memoria RAM explicada sin humo (y desde dentro). Te contamos por qué los kits DDR5 se han puesto por las nubes: tres fabricantes de chip (Samsung, SK Hynix, Micron), líneas movidas a HBM para IA, menos DDR5/NAND para consumo y un “efecto dominó” que ya encarece SSD y GPU. Hablamos de stock volando, pedidos cancelados, subidas reales (kits de 32 GB que han pasado de 120 € a 300–400 €), y cómo te afecta al montar o actualizar tu",2025-12-21 19:00:30+00:00,,1340,False,77932,3706,669,https://i.ytimg.com/vi/Jt_PkKK2vzc/maxresdefault.jpg,https://www.youtube.com/watch?v=Jt_PkKK2vzc,2025,12,Dec,6,Sunday,51,5.614,4.755,0.858,Alto,11,52
xGa8wM8wOVk,La Caja Gaming que lo Cambia Todo (-10 Grados) | Test Corsair 5400,"Nuestros equipos montados de Corsair: https://epical-q.com/pc-powered-by-corsair-icue/ En este vídeo comparamos cajas y gabinetes de PC de doble cámara y triple cámara, analizando el nuevo diseño de Corsair y su impacto real en temperaturas, airflow y refrigeración líquida. Probamos ambos sistemas con los mismos componentes de alta gama y tests de estrés para ver si la caja de triple cámara marca de verdad la diferencia. Ideal si estás pensando en montar un PC gaming o entusiasta y buscas la me",2025-12-14 19:00:00+00:00,,845,False,29389,1443,173,https://i.ytimg.com/vi/xGa8wM8wOVk/maxresdefault.jpg,https://www.youtube.com/watch?v=xGa8wM8wOVk,2025,12,Dec,6,Sunday,50,5.499,4.91,0.589,Medio,13,66
osCnvS7C7rs,Toda la RAM del mundo está en este PC - Jugando con un PC Profesional,"Las mejores ofertas en gaming aquí: https://epical-q.com/ Hoy ponemos a prueba una workstation de 20.000 € para ver si “corre Fortnite” y compañía. Monta AMD Threadripper Pro 9965WX, 384 GB de RAM y NVIDIA RTX 6000 Blackwell (96 GB VRAM) con PCIe 5.0 x16 y fuente FSP 1650 W Platinum. Benchmarks reales (Cinebench 2024), juegos (Fortnite UE5 con DLSS + Ray Tracing, CS2, Borderlands 4, Among Us) y métricas de FPS, uso de CPU/GPU y consumo. ¿Conclusión? La potencia sin optimización no sirve para ga",2025-12-07 19:00:50+00:00,,571,False,53009,1886,143,https://i.ytimg.com/vi/osCnvS7C7rs/maxresdefault.jpg,https://www.youtube.com/watch?v=osCnvS7C7rs,2025,12,Dec,6,Sunday,49,3.828,3.558,0.27,Alto,15,69
fAnqrwcMBwM,"La IA nos ha vuelto Tontos, no seas Borrego","Las mejores ofertas en gaming aquí: https://epical-q.com/ ¿Te están metiendo IA hasta en la tostadora? Aquí te cuento cuándo la IA suma de verdad (productividad, creatividad, automatización) y cuándo es puro humo que solo encarece, invade tu privacidad o ralentiza tu PC. Revisamos Copilot (Windows), Gemini (Google), Meta AI y ChatGPT, con ejemplos reales, riesgos (datos, dependencia cognitiva, consumo de recursos) y 6 reglas de uso responsable —incluida la opción de IA local si manejas informac",2025-11-30 19:30:09+00:00,,439,False,6669,545,39,https://i.ytimg.com/vi/fAnqrwcMBwM/maxresdefault.jpg,https://www.youtube.com/watch?v=fAnqrwcMBwM,2025,11,Nov,6,Sunday,48,8.757,8.172,0.585,Bajo,9,43
-bmUV9Q41ZY,"El Fin de Windows 10, ¿Actualizar al 11?","Las mejores ofertas en gaming aquí: https://epical-q.com/ Windows 10 ya no tiene soporte y Windows 11 viene cargadito de “sorpresas”. En este vídeo te cuento, sin dramas pero con humor, qué riesgos reales tiene seguir en Windows 10 (seguridad, compatibilidad de software) y qué problemas están dando las últimas actualizaciones de Windows 11. Además, te doy un plan claro para no romper nada: cuándo actualizar, qué desactivar, cómo hacer copias de seguridad y cómo evitar los fallos más comunes has",2025-11-23 19:00:01+00:00,,705,False,25005,1517,274,https://i.ytimg.com/vi/-bmUV9Q41ZY/maxresdefault.jpg,https://www.youtube.com/watch?v=-bmUV9Q41ZY,2025,11,Nov,6,Sunday,47,7.163,6.067,1.096,Medio,8,40
89_fz_lIq_M,"Mejor Resolución para Jugar (HD, FHD, QHD, UHD)","Las mejores ofertas en gaming aquí: https://epical-q.com/ ¿1080p, 1440p (mal llamado 2K), 4K u 8K? En este vídeo te explico, sin humo, qué resolución te conviene para jugar o trabajar, cómo afecta al rendimiento (FPS/Hz), y qué tamaños y distancias se ven realmente bien. Verás el “sweet spot” actual, cuándo compensa subir a 4K y por qué 8K todavía no es práctico para gaming. 00:00 — Resoluciones de pantalla y por qué importan para gaming 00:00:37 — 720p vs 1080p (Full HD) 00:02:44 — 1440p / “2",2025-11-16 19:00:14+00:00,,565,False,28913,2010,224,https://i.ytimg.com/vi/89_fz_lIq_M/maxresdefault.jpg,https://www.youtube.com/watch?v=89_fz_lIq_M,2025,11,Nov,6,Sunday,46,7.727,6.952,0.775,Medio,8,47
g0gS-IAZhxs,9 Trucos para Comprar Hardware en BF sin que te TIMEN :S,"Hacemos los mejores ordenadores pre montados con 3 años de garantía, nuestras ofertas aquí: https://epical-q.com/ BLACK FRIDAY: te van a intentar timar (y lo sabes). En este vídeo te explico cómo aprovechar descuentos reales en tecnología y gaming (PCs, portátiles, gráficas, periféricos, electrónica) y cómo evitar las trampas típicas: subidas previas de precio, “-70%” imposibles, contadores falsos, “quedan 3 unidades”, portátiles con i7 de hace 7 generaciones, etc. Además, te cuento cuándo com",2025-11-09 19:00:41+00:00,,568,False,15244,1220,102,https://i.ytimg.com/vi/g0gS-IAZhxs/maxresdefault.jpg,https://www.youtube.com/watch?v=g0gS-IAZhxs,2025,11,Nov,6,Sunday,45,8.672,8.003,0.669,Medio,12,56
B_9Qy5T8kIk,"Montamos un Servidor de 96TB: RAID, TRUE NAS, N8N","Los mejores ordenadores y ofertas aquí: https://epical-q.com/ Hoy continuamos con el montaje de nuestro de servidores en local y las diferentes formas de RAID que podemos montarlo. Recuerda, que si tienes un proyecto contacta con nosotros y vemos como podemos hacerlo realidad. #minipc #nas #truenas #localserver",2025-11-02 18:45:03+00:00,,968,False,9123,600,56,https://i.ytimg.com/vi/B_9Qy5T8kIk/maxresdefault.jpg,https://www.youtube.com/watch?v=B_9Qy5T8kIk,2025,11,Nov,6,Sunday,44,7.191,6.577,0.614,Bajo,9,49
